3.1.120,DAMAGE_AGENT_CD1,Damage agent code 1 ,NUMBER(5),"(core: all live tally trees ω5.0 inches d.b.h./d.r.c; core optional: all live tally trees ω1.0 inch d.b.h./d.r.c.) A code indicating the first damage agent recorded by the field crew when inspecting the tree from bottom to top (roots, bole, branches, foliage). Up to three damage agents can be recorded per tree (DAMAGE_AGENT_CD1, DAMAGE_AGENT_CD2, and DAMAGE_AGENT_CD3). Damage agents are not necessarily recorded in order of severity.The codes used for damage agents come from the January 2012 Pest Trend Impact Plot System (PTIPS) list from the Forest Health Assessment and Applied Sciences Team (FHAAST) that has been modified to meet FIA's needs. The list is modified by each region to meet the specific needs of that region. The general agent codes are listed here. See appendix H for the complete list of codes.
Note: Starting with PLOT.MANUAL = 9.4, damage agent code = 90001 (broken top) was retired and replaced with TREE.ABNORMAL_TERMINATION."
3.1.121,DAMAGE_AGENT_CD2,Damage agent code 2,NUMBER(5),(core: all live tally trees ω5.0 inches d.b.h./d.r.c; core optional: all live tally trees ω1.0 inch d.b.h./d.r.c.) See DAMAGE_AGENT_CD1.
3.1.122,DAMAGE_AGENT_CD3,Damage agent code 3,NUMBER(5),(core: all live tally trees ω5.0 inches d.b.h./d.r.c; core optional: all live tally trees ω1.0 inch d.b.h./d.r.c.) See DAMAGE_AGENT_CD1.
3.1.123,CENTROID_DIA,Centroid diameter (Pacific Islands) ,"NUMBER(4,1)","The outside bark diameter, in inches, measured at CENTROID_DIA_HT_ACTUAL. For tree ferns, diameter is measured where the fronds emerge from the trunk. Only populated by certain FIA work units (SURVEY.RSCD = 26) for the Pacific Islands. This diameter is part of the upper stem diameter protocol that began with remeasurement, except for Hawaii, where the protocol was implemented in the first measurement."
3.1.124,CENTROID_DIA_HT,Calculated centroid diameter height (Pacific Islands),"NUMBER(4,1)","The height, in feet, to stem centroid. The stem centroid is located at 30 percent of the total length (HT) of the stem. Only populated by certain FIA work units (SURVEY.RSCD = 26) for the Pacific Islands. This height is part of the upper stem diameter protocol that began with the first remeasurement, except for Hawaii, where the protocol was implemented in the first measurement."
3.1.125,CENTROID_DIA_HT_ACTUAL,Actual centroid diameter height (Pacific Islands),"NUMBER(4,1)","The height, in feet, to where stem centroid diameter was actually measured. It may differ from CENTROID_DIA_HT if abnormalities in the stem prevented a normal diameter measurement. Only populated by certain FIA work units (SURVEY.RSCD = 26) for the Pacific Islands. This height is part of the upper stem diameter protocol that began with the first remeasurement, except for
Hawaii, where the protocol was implemented in the first measurement."
3.1.126,UPPER_DIA,"Upper stem diameter (Pacific
Islands)","NUMBER(4,1)","The outside bark upper stem diameter, in inches, measured at least 3 feet above the point where DIA was taken. For larger trees, UPPER_DIA was recorded at the point where the main stem was at least 4.0 inches in diameter. This diameter is used in the calculation of stem taper, needed to improve the estimation of stem volume. Only populated by certain FIA work units (SURVEY.RSCD = 26) for the Pacific Islands. This is the legacy upper stem diameter protocol and will not be collected after the first remeasurement."
3.1.127,UPPER_DIA_HT,Upper stem diameter height (Pacific Islands),"NUMBER(4,1)","The height, in feet, to where upper stem diameter (UPPER_DIA) was measured. Only populated by certain FIA work units (SURVEY.RSCD= 26) for the Pacific Islands. This is the legacy upper stem diameter protocol and will not be collected after the first remeasurement."
3.1.128,VOLCSSND,Sound cubic-foot wood volume in the sawlog portion of a sawtimber tree,"NUMBER(11,6)","The sound cubic-foot volume of wood in the central stem of a timber species tree of sawtimber size (9.0 inches d.b.h. minimum for softwoods, 11.0 inches minimum d.b.h. for hardwoods), from a 1-foot stump to a minimum top diameter (7.0 inches for softwoods, 9.0 inches for hardwoods) or to where the central stem breaks into limbs, all of which are less than the minimum top diameter. This is a per tree value and must be multiplied by TPA_UNADJ to obtain per acre information. This attribute is blank (null) for softwood trees with DIA <9.0 inches (<11.0 inches for hardwoods). All sawtimber-size trees have entries in this field if they are growing-stock trees (TREECLCD = 2 and STATUSCD = 1). All rough and rotten trees (TREECLCD = 3 or 4) and dead and cut trees (STATUSCD = 2 or 3) are blank (null) in this field. Does not include rotten and missing cull (volume loss due to rotten and missing cull defect has been deducted). Refer to appendix K for information on FIA volume, biomass, and carbon estimation."
3.1.129,DRYBIO_SAWLOG,Dry biomass of wood in the sawlog portion of a sawtimber tree,"NUMBER(13,6)","The oven-dry biomass, in pounds, of wood in the sawlog portion of timber species trees of sawtimber size (9.0 inches d.b.h. minimum for softwoods, 11.0 inches minimum d.b.h. for hardwoods), from a 1-foot stump to a minimum top diameter (7.0 inches for softwoods, 9.0 inches for hardwoods) or to where the central stem breaks into limbs, all of which are less than the minimum top diameter. This is a per tree value and must be multiplied by TPA_UNADJ to obtain per acre information. This attribute is blank (null) for softwood trees with DIA <9.0 inches (<11.0 inches for hardwoods) and standing dead trees. Refer to appendix K for information on FIA volume, biomass, and carbon estimation."
3.1.130,DAMAGE_AGENT_CD1_SRS,"Damage agent code 1 (Caribbean Islands), Southern Research Station",NUMBER(5),"A code indicating the first damage agent observed when inspecting the tree from bottom to top (roots, bole, branches, foliage). Up to three damage agents can be recorded (DAMAGE_AGENT_CD1_SRS, DAMAGE_AGENT_CD2_SRS, DAMAGE_AGENT_CD3_SRS). If more than one agent is observed, the most threatening one is listed first where agents threatening survival are listed first and agents threatening wood quality second. The codes used for damage agents come from the January 2012 Pest Trend Impact Plot System (PTIPS) list from the Forest Health Assessment and Applied Sciences Team (FHAAST) that has been modified to meet FIA's needs. See appendix H for the complete list of codes. Only populated by certain FIA work units (SURVEY.RSCD = 33) for the Caribbean Islands."
3.1.131,DAMAGE-AGENT_CD2_SRS,"Damage agent code 2 (Caribbean Islands), Southern Research Station",NUMBER(5),See DAMAGE_AGENT_CD1_SRS.
3.1.132,DAMAGE_AGENT_CD3_SRS,"Damage agent code 3 (Caribbean Islands), Southern Research Station",NUMBER(5),See DAMAGE_AGENT_CD1_SRS.
3.1.133,DRYBIO_AG,Aboveground dry biomass of wood and bark,"NUMBER(13,6)","The oven-dry biomass, in pounds, of wood and bark in the aboveground portion, excluding foliage, of live and standing dead trees ω1.0 inch d.b.h./d.r.c. This is a per tree value and must be multiplied by TPA_UNADJ to
obtain per acre information. Refer to appendix K on FIA volume, biomass, and carbon estimation.
Note: Not populated for standing dead saplings (1.0-4.9 inches d.b.h./d.r.c.) when PLOT.MANUAL <7.0."
3.1.134,ACTUALHT_CALC,"Actual height, calculated",NUMBER(3),The calculated length (height) of the tree to the nearest foot from ground level to the highest remaining portion of the tree still present and attached to the bole. The calculations are made using regional methods.
3.1.135,ACTUALHT_CALC_CD,"Actual height, calculated, code",NUMBER(1),"A code identifying the method used to calculate the ACTUALHT_CALC value. Only populated by certain FIA work units (SURVEY.RSCD = 24). For more information about regional methods, contact the appropriate FIA work unit (table 1-1)."
3.1.136,CULL_BF_ROTTEN,Rotten/missing board-foot cull of the sawlog,"NUMBER(12,9)","The percent of volume within the recorded sawlog length (SAWHT) that cannot be used to produce boards, because of rot or missing sections of the bole. Does not include cull due to sweep, crook, excessive branches (e.g., whorls), large limbs and other defects. Only populated by certain FIA work units (SURVEY.RSCD= 24). Not collected for all years or States."
3.1.137,CULL_BF_ROTTEN_CD,Rotten/missing board-foot cull of the sawlog code,NUMBER(2),A code indicating if the CULL_BF_ROTTEN attribute is not null. Only populated by certain FIA work units (SURVEY.RSCD = 24). Not collected for all years or States.
3.1.138,CULL_BF_ROUGH,Rough board-foot cull of the sawlog ,"NUMBER(12,9)","The percent of volume within the recorded sawlog length (SAWHT) that cannot be used to produce boards, because of sweep, crook, excessive branches (e.g., whorls), large limbs and other defects. Does not include cull due to rot. Only populated by certain FIA work units (SURVEY.RSCD = 24). Not collected for all years or States."
3.1.139,CULL_BF_ROUGH_CD,Rough board-foot cull of the sawlog code,NUMBER(2),A code indicating if the CULL_BF_ROUGH attribute is not null. Only populated by certain FIA work units (SURVEY.RSCD = 24). Not collected for all years or States.
3.1.140,PREVDIA_FLD,"Previous diameter, field",NUMBER,"The previous diameter, in inches, of the sample tree at the point of diameter measurement, if the value was updated by the current field crew.
Note: PREVDIA differs from PREVDIA_FLD when the field crew updates the downloaded value in the data collection program.
• PREVDIA - This value is the downloaded diameter from the previous inventory record.
• PREVDIA_FLD - This value is the editable field."
3.1.141,TREECLCD_31_NCRS,"Tree class code (version 3.1), North Central Research Station",NUMBER(1),"A classification of the general quality of a tree that is ω5.0 inches d.b.h. It classifies the quality of a live sawtimber tree based on the present condition. It also forecasts the potential quality of a live poletimber tree when it becomes sawtimber size. For standing dead trees, it identifies those trees that could be salvaged for wood fiber (e.g., chips) if a salvage operation was imminent.
Collected on all live and dead trees ω5.0 inches d.b.h. for States in the NCRS region (SURVEY.RSCD = 23) for PLOT.MANUAL_NCRS ω3.0."
3.1.142,TREE_GRADE_NCRS,"Tree grade, North Central Research Station",NUMBER(3),"A 3-digit code indicating the quality of sawtimber-sized trees that have a TREECLCD_NCRS of 20 or 31. The first digit indicates the grade and the second and third digits represent the limiting factor for hardwood grades.
Minimum sawlog length for tree grades is 12 feet and for log grades is 8 feet. Sawlog lengths do not extend above large forks, have excessive limbs or other defects, or have a section of the tree bole that does not meet minimum log grade specification. Limitations or ""stoppers"" for all softwoods and for hardwood grades 1, 2 and 3 include: any limb (live or dead) having a collar diameter exceeding the stem DOB at that point; or any group of 2.0-inch collar diameter or larger limbs (live or dead), within a 1-foot span, having a combined sum of diameters greater than the stem DOB of that section. Limitations for grade 4 hardwoods include: any limb or group of limbs, within a 1 foot span, with a collar diameter or sum of collar diameters greater than 1/3 of the stem DOB of that section.
Data collected for States in the NCRS region (SURVEY.RSCD = 23) in inventory years 1999-2009, PLOT.MANUAL_NCRS = 1.0-4.0. Refer to PLOT.MANUAL_NCRS for additional information (such as tables on tree grades and standard specifications for logs).
First digit:
• For a hardwood sawtimber tree (TREECLCD_NCRS = 20), the grade of the sawlog portion of the tree is based on ""Hardwood Tree Grades for Factory Lumber"" (Hanks 1976). 
• For a softwood sawtimber tree (TREECLCD_NCRS = 20), the grade is based on the portion of the log that gives the best grade. For a softwood, where TREECLCD_NCRS = 31, the grade is based on the log that is present.
Second and third digits:
• For hardwoods with a grade 2, 3, 4, or 5, the second and third digit indicate the limiting quality factor that is keeping the log from moving into a better quality grade. For hardwood logs with a grade 5, the second digit is a 2 or 7 when an 8-foot log is present. If a 12-foot upper log is present, the second digit is 6.
• For softwoods, the second and third digits are always '00'."
3.1.143,BOUGHS_AVAILABLE_NCRS,"Balsam fir boughs available, North Central Research Station",NUMBER(1),"A code indicating if harvestable balsam fir boughs are present on trees ω1.0 inch d.b.h. Boughs are harvestable if they occur in the bottom 7.5 feet of the tree and there is at least one branch no larger in diameter than a pencil where clipped and they are at least 18 inches in length with live needles.
Data populated for States in the NCRS region (SURVEY.RSCD = 23) for PLOT.MANUAL_NCRS = 2.0-3.0 (INVYR = 2004-2006). Only populated in Minnesota for PLOT.MANUAL_NCRS = 3.1-4.0 (INVYR in 2007, 2008)."
3.1.144,BOUGHS_HRVST_NCRS,"Balsam fir boughs harvested, North Central Research Station",NUMBER(1),"A code indicating whether or not balsam fir boughs were harvested on trees ω1.0 inch d.b.h.
Data populated for States in the NCRS region (SURVEY.RSCD = 24) for
PLOT.MANUAL_NCRS = 2.0-3.0 (INVYR = 2004-2006). Only populated in Minnesota for PLOT.MANUAL_NERS = 3.1-4.0 (INVYR in 2007, 2008)."
3.1.145,TREECLCD_31_NERS,"Tree class code (version 3.1),
Northeastern Research Station",NUMBER(1),"A classification of the general quality of a tree that is ω5.0 inches d.b.h. It classifies the quality of a live sawtimber tree based on the present condition. It also forecasts the potential quality of a live poletimber tree when it becomes sawtimber size. For standing dead trees, it identifies trees that could be salvaged for wood fiber (e.g., chips) if a salvage operation was imminent. Implemented beginning with PLOT.MANUAL_NERS = 3.1 (inventory year 2007)
of the field guide.
Data collected as follows (SURVEY.RSCD = 24):
• All trees ω5.0 inches d.b.h./d.r.c. when STATUSCD = 1 or 2 and STANDING_DEAD_CD_NERS = 1.
• Annual data inventory years 2007 to present."
3.1.146,AGENTCD_NERS,"General damage / cause of death (agent) code, Northeastern Research Station",NUMBER(2),"The cause of death for all trees since the previous survey. Also used as a damage indicator for periodic surveys until 2000.
Data collected as follows (SURVEY.RSCD = 24):
• Annual data through inventory year 2006, except Ohio (39).
• Last periodic for CT, DE, MD, MA, NH, NJ, NY, RI, VT and WV:
1993: New York (36)
1997: New Hampshire (33), Vermont (50)
1998: Connecticut (9), Massachusetts (25), Rhode Island (44)
1999: Delaware (10), Maryland (24), New Jersey (34)
2000: West Virginia (54)"
3.1.147,BFSNDCD_NERS,"Board-foot soundness code,
Northeastern Research Station",NUMBER(1),"A code based on percentage of board-foot cull that is sound cull. Sound cull is caused by form defects: sweep, crook, limbs and forks.
Data collected as follows (SURVEY.RSCD = 24):
• Live and dead trees, ω9.0 inches d.b.h. if softwood, and ω11.0 inches d.b.h. if hardwood.
• Annual data through inventory year 2006, except Ohio (39).
• Last periodic for CT, DE, MD, MA, NH, NJ, NY, RI, VT and WV:
1993: New York (36)
1997: New Hampshire (33), Vermont (50)
1998: Connecticut (9), Massachusetts (25), Rhode Island (44)
1999: Delaware (10), Maryland (24), New Jersey (34)
2000: West Virginia (54)"
3.1.148,AGECHKCD_RMRS,"Radial growth and tree age check code, Rocky Mountain Research Station",NUMBER(1),"A code indicating the method used to obtain radial growth and tree age. Only populated by certain FIA work units (SURVEY.RSCD = 22).
Note: Code 3 was added starting with PLOT.MANUAL = 6.0."
3.1.149,PREV_AGECHKCD_RMRS,"Previous radial growth and tree age check code, Rocky Mountain Research Station",NUMBER(1),"A code indicating the method used to obtain radial growth and tree age assigned at the previous inventory (from annual or periodic data). Populated for PLOT.MANUAL ω4.0. Only populated by certain FIA work units (SURVEY.RSCD = 22).
Note: Code 3 was added starting with PLOT.MANUAL = 6.0."
3.1.150,PREV_BHAGE_RMRS,"Previous breast height age, Rocky Mountain Research Station",NUMBER(4),"The breast height age (BHAGE) assigned to a tree at the previous inventory (from annual or periodic data). Populated for PLOT.MANUAL ω4.0.
BHAGE is the age of a live tree derived from counting tree rings from an increment core sample extracted at a height of 4.5 feet above ground. Breast height age is collected for a subset of trees and only for trees where the diameter is measured at breast height (d.b.h.). This data item is used to calculate classification attributes such as stand age. It is left blank (null) when it is not collected.
For RMRS (SURVEY.RSCD = 22), one tree is sampled for each species and broad diameter class present on a plot."
3.1.151,PREV_TOTAGE_RMRS,"Previous total age, Rocky Mountain Research Station",NUMBER(4),"The total age assigned to a tree at the previous inventory (from annual or periodic data). Populated for PLOT.MANUAL ω4.0. The age for live trees is derived by counting tree rings from an increment core sample extracted at the base of a tree where diameter is measured at root collar (d.r.c.), or for small saplings (1.0-2.9 inches d.b.h.) by counting all branch whorls, or by adding a species-dependent number of years to breast height age. Total age is collected for a subset of trees and is used to calculate classification attributes such as stand age. It is left blank (null) when it is not collected. Only populated by certain FIA work units
(SURVEY.RSCD = 22)."
3.1.152,PREV_TREECLCD_RMRS,"Previous tree class code, Rocky Mountain Research Station",NUMBER(2),"The tree class (TREECLCD_RMRS) assigned at the previous inventory (from annual or periodic data). This attribute is downloaded from the previous inventory and is editable by the current field crew. If the past tree class is obviously wrong (e.g., the previous code was recorded as 6 [soft dead] and the tree is still alive), an updated PREV_TREECLCD_RMRS is recorded. This attribute is also recorded for new mortality trees. Only populated by certain FIA work units (SURVEY.RSCD = 22)."
3.1.153,RADAGECD_RMRS,"Radial growth / age code, Rocky Mountain Research Station",NUMBER(1),"A code indicating if growth and/or age information is required for the tree.
Tree age and radial growth information are collected for specified tally trees and timber species site trees. In addition, age information is collected for timber species seedling counts. General guidelines for radial growth and age tree selection are as follows:
Radial growth and age tree selection guidelines:
• Timber species -
 Radial growth information is required for a minimum of two trees in each diameter class (starting with the 4-inch class) for each species.
 Age information is required for a minimum of one tree in each diameter class and species, and for one timber species seedling count per species (i.e., one count for each species group for the entire plot, not condition class).
 For both radial growth and age, if rough or rotten trees are bored, select additional sound trees if tallied.
• Woodland species -
 For each woodland genus group tallied across the subplots, select one
representative live tally tree within each stand-size class tallied. Core the largest stem near the base to obtain the age and radial."
3.1.154,RADGRW_RMRS,"Radial growth, Rocky Mountain Research Station",NUMBER(2),"A 2-digit number indicating the length of a 10-year radial increment for trees that require radial growth information to be collected (see RADAGECD_RMRS for radial growth and age tree selection guidelines). Radial growth measurement is taken to the nearest 1/20th inch for the last 10 years of radial growth from an increment core taken immediately below the point of diameter measurement and at a right angle to the bole. Using a ruler with a 1/20th-inch scale, the length on the core is measured from the inner edge of the last (most recent) complete summer wood ring to the inner edge of the summer wood ring 10 years previous (for example, 6/20 inches is recorded as 06 and 23/20 inches is recorded as 23). Only populated by certain FIA work units (SURVEY.RSCD = 22)."
3.1.155,VOLBSGRS,Gross board-foot wood volume in the sawlog portion of a sawtimber tree (Scribner Rule),"NUMBER(11,6)","The total board-foot (Scribner Rule) volume of wood in the central stem of a timber species tree of sawtimber size (9.0 inches d.b.h. minimum for softwoods, 11.0 inches d.b.h. minimum for hardwoods), from a 1-foot stump to a minimum top diameter (7.0 inches for softwoods, 9.0 inches for hardwoods), or to where the central stem breaks into limbs all of which are less than the minimum top diameter. This is a per tree value and must be multiplied by TPA_UNADJ to obtain per unit area information. This attribute is blank (null) for softwood trees with DIA <9.0 inches (<11.0 inches for hardwoods). All sawtimber-size trees have entries in this field if they are growing-stock trees (TREECLCD = 2 and STATUSCD = 1). All rough and rotten trees (TREECLCD = 3 or 4) and dead and cut trees (STATUSCD = 2 or 3) are blank (null) in this field. Only populated by certain FIA work units (SURVEY.RSCD = 22, 26, 27)."
3.1.156,VOLBSNET,Net board-foot wood volume in the sawlog portion of a sawtimber tree (Scribner Rule),"NUMBER(11,6)","The net board-foot (Scribner Rule) volume of wood in the central stem of a timber species tree of sawtimber size (9.0 inches d.b.h. minimum for softwoods, 11.0 inches d.b.h. minimum for hardwoods), from a 1-foot stump to a minimum top diameter (7.0 inches for softwoods, 9.0 inches for hardwoods), or to where the central stem breaks into limbs all of which are less than the minimum top diameter. This is a per tree value and must be multiplied by TPA_UNADJ to obtain per unit area information. This attribute is blank (null) for softwood trees with DIA <9.0 inches (<11.0 inches for hardwoods). All sawtimber-size trees have entries in this field if they are growing-stock trees (TREECLCD = 2 and STATUSCD = 1). All rough and rotten trees (TREECLCD = 3 or 4) and dead and cut trees (STATUSCD = 2 or 3) are blank (null) in this field. Form cull and rotten/missing cull are excluded. Only populated by certain FIA work units (SURVEY.RSCD = 22, 26, 27)."
3.1.157,SAPLING_FUSIFORM_SRS,"Sapling fusiform, Southern Research Station",NUMBER(1),"A code indicating the incidence of fusiform occurring on the main stem or on a live branch within 12 inches of the main stem of longleaf, slash, and loblolly pine saplings (STATUSCD = 1 and SPCD = 11, 121, or 131 and 1 η DIA <5). Only populated by certain FIA work units (SURVEY.RSCD = 33). Not populated for the Caribbean Islands."
3.1.158,EPIPHYTE_PNWRS,"Epiphyte loading (Pacific Islands), Pacific Northwest Research Station",NUMBER(1),"A rating indicating the extent of epiphyte loading. Epiphytes are defined as plants that use the tree for support, however, they do not draw nourishment from it. The rating is based on the Hawksworth (1979) six-class rating system. Using this rating system, the live crown is divided into thirds, and each third is rated using the following scale: 0 is for no visible epiphytes, 1 for <50 percent of the branches or bole loaded with epiphytes, 2 for >50 percent of the branches or bole loaded with epiphytes. The ratings for each third are summed together to yield the Hawksworth rating. This rating is collected for all live trees ω1.0 inch d.b.h. Only populated by certain FIA work units (SURVEY.RSCD = 26)."
3.1.159,ROOT_HT_PNWRS,"Rooting height (Pacific Islands), Pacific Northwest Research Station",NUMBER(2),The height of the stilted or buttressed root system from the ground level to the highest point where the stilts or buttresses protrude from the bole of the tree. Measured to the nearest foot. Only populated by certain FIA work units (SURVEY.RSCD = 26).
3.1.160,CAVITY_USE_PNWRS,"Cavity presence, Pacific Northwest Research Station",VARCHAR2(1),A code indicating the largest cavity present in a live tree that is utilized by wildlife. Only populated by certain FIA work units (SURVEY.RSCD = 26). Not populated for the Pacific Islands.
3.1.161,CORE_LENGTH_PNWRS,"Length of measured core, Pacific Northwest Research Station","NUMBER(4,1)","The total length, in inches, of the extracted core used when the tree age is extrapolated. Only populated by certain FIA work units (SURVEY.RSCD = 26). Not populated for the Pacific Islands."
3.1.162,CULTURALLY_KILLED_PNWRS,"Culturally killed code, Pacific Northwest Research Station",NUMBER(1),"A code indicating if a cut tree was killed by direct human intervention, but not utilized (removed from plot). Only populated by certain FIA work units (SURVEY.RSCD = 26, 27). Not populated for the Pacific Islands."
3.1.163,DIA_EST_PNWRS,"Standing dead estimated diameter, Pacific Northwest Research Station","NUMBER(4,1)","An estimate of the diameter at breast height for a standing dead tree when it was alive. Only populated by certain FIA work units (SURVEY.RSCD = 26, 27). Not populated for the Pacific Islands."
3.1.164,GST_PNWRS,"Growth sample tree, Pacific Northwest Research Station",VARCHAR2(1),"A code indicating whether or not a tree is to be measured for total length and actual length and used as a growth sample tree. Only populated by certain FIA work units (SURVEY.RSCD = 26, 27). Not populated for the Pacific Islands."
