3.1.57,TOTAGE,Total age ,NUMBER(4),"The age of a live tree derived either from counting tree rings from an
increment core sample extracted at the base of a tree where diameter is measured at root collar (d.r.c.), or for small saplings (1.0-2.9 inches d.b.h.) by counting all branch whorls, or by adding a species-dependent number of years to breast height age. Total age is collected for a subset of trees and is used to calculate classification attributes such as stand age. Only populated by certain FIA work units (SURVEY.RSCD = 22, 26) and is left blank (null) when it is not collected."
3.1.58,CULLDEAD,Dead cull,NUMBER(3),"The percentage of cubic-foot volume in the merchantable bole that is cull due to sound dead material. Recorded for trees ω5.0 inches d.b.h./d.r.c. The merchantable bole is from a 1-foot stump to a 4-inch top diameter outside bark (DOB). For woodland species (REF_SPECIES. WOODLAND = 'Y'), the merchantable portion is between the point of d.r.c. measurement to a 1.5-inch top DOB. For trees with broken tops, cull above the actual height (ACTUALHT) is not included. Only populated by certain FIA work units (SURVEY.RSCD = 22)."
3.1.59,CULLFORM,Form cull ,NUMBER(3),"The percentage of cubic-foot volume in the sawlog portion that is cull due to form defect. Recorded for live timber species of sawtimber size (9.0 inches d.b.h. minimum for softwoods, 11.0 inches d.b.h. minimum for hardwoods). The sawlog portion is from a 1-foot stump to a 7.0-inch top diameter outside bark (DOB) for softwoods and a 9.0-inch top DOB for hardwoods. For trees with broken tops, cull above the actual height
(ACTUALHT) is not included. This attribute is blank (null) for dead trees and woodland species (REF_SPECIES.WOODLAND = 'Y'). Only populated by certain FIA work units (SURVEY.RSCD = 22)."
3.1.60,CULLMSTOP,Missing top cull ,NUMBER(3),"The percentage of cubic-foot volume that is cull due to a missing
(broken) merchantable top. Recorded for trees ω5.0 inches d.b.h./d.r.c. This estimate does not include any portion of the missing top that is <4.0 inches diameter outside bark (DOB). Some broken-top trees have 0 percent missing top cull because no merchantable volume was lost. For woodland species (REF_SPECIES.WOODLAND = 'Y') with multiple stems, CULLMSTOP = 0 is recorded. Only populated by certain FIA work units (SURVEY.RSCD = 22)."
3.1.61,CULLBF,Board-foot cull ,NUMBER(3),"The percent of the gross board-foot volume that is cull due to rot or form.
Only populated by certain FIA work units (SURVEY.RSCD = 24)."
3.1.62,CULLCF,Cubic-foot cull ,NUMBER(3),"The percent of the gross cubic-foot volume that is cull due to rot or form.
Only populated by certain FIA work units (SURVEY.RSCD = 24)."
3.1.63,BFSND,Board-foot-cull soundness ,NUMBER(3),The percent of the board-foot cull that is sound (due to form). Only populated by certain FIA work units (SURVEY.RSCD = 24).
3.1.64,CFSND,Cubic-foot-cull soundness ,NUMBER(3),"The percent of the cubic-foot cull that is sound (due to form).
Only populated by certain FIA work units (SURVEY.RSCD = 24)."
3.1.65,SAWHT,Sawlog height ,NUMBER(2),"The length (height) of a tree, recorded to a 7-inch top (9-inch for hardwoods), where at least one 8-foot log, merchantable or not, is present. On broken topped trees, sawlog length is recorded to the point of the break. Only populated by certain FIA work units (SURVEY.RSCD = 24)."
3.1.66,BOLEHT,Bole height ,NUMBER(3),"The length between the 1-foot stump and the 4.0-inch top diameter of outside bark (DOB), where at least one 4-foot section is present. In periodic inventories, this attribute was measured in the field. For annual inventories, this attribute is a calculated, modeled value. Only populated by certain FIA work units (SURVEY.RSCD = 24)."
3.1.67,FORMCL,Form class ,NUMBER(1),A code used in calculating merchantable bole net volume. Recorded for all live hardwood trees tallied that are ω5.0 inch d.b.h./d.r.c. Also recorded for conifers ω5.0 inch d.b.h. in Region 5 National Forests (only collected when INVYR = 2001-2009). Only populated by certain FIA work units (SURVEY.RSCD = 26).
3.1.68,HTCALC,Current height calculated ,NUMBER(3),"If the height is unmeasurable (e.g., the tree is cut or dead), the height is calculated, in feet, and stored in this attribute. Only populated by certain FIA work units (SURVEY.RSCD = 33)."
3.1.69,HRDWD_CLUMP_CD,Hardwood clump code ,NUMBER(1),A code sequentially assigned to each hardwood clump within each species as they are found on a subplot. Up to 9 hardwood clumps can be identified and coded within each species on each subplot. A clump is defined as having 3 or more live stems originating from a common point on the root system. Woodland hardwood species are not evaluated for clump code. Clump code data are used to adjust stocking estimates since trees growing in clumps contribute less to stocking than do individual trees. Only populated by certain FIA work units (SURVEY.RSCD = 26).
3.1.70,SITREE,Calculated site index ,NUMBER(3),"Computed for every tree. The site index represents the average total length, in feet, that dominant and co-dominant trees in fully-stocked, even-aged stands (of the same species as this tree) will obtain at key ages (usually 25 or 50 years). Only computed by certain FIA work units (SURVEY.RSCD = 23)."
3.1.71,CREATED_BY,Created by,VARCHAR2(30),The employee who created the record. This attribute is intentionally left blank (null) in download files.
3.1.72,CREATED_DATE,Created date,DATE,The date the record was created.
3.1.73,CREATED_IN_INSTANCE,Created in instance,VARCHAR2(6),The database instance in which the record was created. Each computer system has a unique database instance code and this attribute stores that information to determine on which computer the record was created.
3.1.74,MODIFIED_BY,Modified by,VARCHAR2(30),The employee who modified the record. This field will be blank (null) if the data have not been modified since initial creation. This attribute is intentionally left blank in download files.
3.1.75,MODIFIED_DATE,Modified date,DATE,The date the record was last modified. This field will be blank (null) if the data have not been modified since initial creation.
3.1.76,MODIFIED_IN_INSTANCE,Modified in instance,VARCHAR2(6),The database instance in which the record was modified. This field will be blank (null) if the data have not been modified since initial creation.
3.1.77,MORTCD,Mortality code ,NUMBER(1),"(core optional) Used for a tree that was alive within past 5 years, but has
died. Not populated for standing dead trees <5.0 inches d.b.h./d.r.c. when PLOT.MANUAL <7.0."
3.1.78,HTDMP,Height to diameter measurement point,"NUMBER(3,1)","This value is equal to the actual length, to the nearest 0.1 foot, from ground to the point of diameter measurement. This attribute is populated for trees ω1.0 inch d.b.h., which were not measured for diameter directly at breast height (due to an abnormal swelling, branches, damage, or other at 4.5 feet above ground). This item is blank (null) for trees ω1.0 inch d.b.h., where diameter was measured directly at breast height (4.5 feet above ground) and for woodland species where diameter was measured at root collar. Core optional when PLOT.MANUAL <8.0; core when PLOT.MANUAL ω8.0."
3.1.79,ROUGHCULL,Rough cull,NUMBER(2),"(core optional) The percentage of cubic-foot volume in the merchantable bole that is cull due to sound dead material or tree form. Recorded for live trees ω5.0 inches d.b.h./d.r.c. The merchantable bole is from a 1-foot stump to a 4-inch top diameter outside bark (DOB). For woodland species (REF_SPECIES.WOODLAND = 'Y'), the merchantable portion is between the point of d.r.c. measurement to a 1.5-inch top DOB, and ROUGHCULL only includes sound dead material.
Note:
• For PLOT.MANUAL <2.0, ROUGHCULL only included sound dead material (i.e., it did not include cull due to tree form).
• When SURVEY.RSCD = 26,27, only populated for live conifers, red alder, and bigleaf maple."
3.1.80,MIST_CL_CD,Mistletoe class code,NUMBER(1),"(core optional) A rating of dwarf mistletoe infection. Recorded on all live conifer species except juniper. Using the Hawksworth (1979) six-class rating system, the live crown is divided into thirds, and each third is rated using the following scale: 0 is for no visible infection, 1 for <50 percent of branches infected, 2 for >50 percent of branches infected. The ratings for each third are summed together to yield the Hawksworth rating."
3.1.81,CULL_FLD,"Rotten/missing cull, field recorded",NUMBER(2),"(core: ω5.0-inch live trees; core optional: ω5.0-inch standing dead trees) The percentage rotten or missing cubic-foot cull volume, estimated to the nearest 1 percent. This estimate does not include any cull estimate above actual length; therefore volume lost from a broken top is not included (see CULL for percent cull including cull from broken top). When field crews estimate volume loss (tree cull), they only consider the cull on the merchantable bole of the tree, from a 1-foot stump to a 4-inch top diameter outside bark (DOB). For woodland species, the merchantable portion is between the point of d.r.c. measurement to a 1.5-inch top DOB."
3.1.82,RECONCILECD,Reconcile code ,NUMBER(1),"A code indicating the reason a tree either enters or is no longer a part of
the inventory. Only recorded for remeasurement locations.
Notes:
• Starting with PLOT.MANUAL = 9.0, codes 1-2 are only valid for new trees (STATUSCD = 1, 2) on the plot and exclude trees associated with a change in procedures/definitions or previous cruiser error, as such trees are accounted for with RECONCILECD = 7 or 8. Codes 6-9 are valid for both new tally trees and remeasured trees that no linger qualify
as tally.
• When PLOT.MANUAL = 7.0 through 8.0, standing dead saplings that were not included in the previous inventory were assigned RECONCILECD = 4."
3.1.83,PREVDIA,Previous diameter ,"NUMBER(5,2)","The previous diameter, in inches, of the sample tree at the point of
diameter measurement. Populated for remeasured trees."
3.1.84,P2A_GRM_FLG,"Periodic to annual growth, removal, and mortality flag",VARCHAR2(1),"A code indicating if this tree is part of a periodic inventory that is only included for the purposes of computing growth, removals and/or mortality estimates. The flag is set to 'Y' for those trees that are needed for estimation and otherwise is left blank (null)."
3.1.85,TREECLCD_NERS,"Tree class code, Northeastern
Research Station",NUMBER(2),"In annual inventory, this code represents a classification of the overall quality of a tree that is ω5.0 inches d.b.h. It classifies the quality of a sawtimber tree based on the present condition, or it classifies the quality of a poletimber tree as a prospective determination (i.e., a forecast of potential quality when and if the tree becomes sawtimber size). For more detailed description, see the regional field guide located at the NRS Data Collection web page (https://research.fs.usda.gov/nrs/programs/fia). Only populated by certain FIA work units (SURVEY.RSCD = 24)."
3.1.86,TREECLCD_SRS,"Tree class code, Southern Research Station",NUMBER(2),"A code indicating the general quality of the tree. Prior to the merger of the Southern and Southeastern Research Stations (INVYR 1997), a growing-stock classification (code 2) was only assigned to species that were considered to have commercial value. Since the merger (INVYR >1997), code 2 has been applied to all tree species meeting the growing-stock form, grade, size and soundness requirements, regardless of commercial value. Only populated by certain FIA work units (SURVEY.RSCD = 33)."
3.1.87,TREECLCD_NCRS,"Tree class code, North Central
Research Station",NUMBER(2),"In annual inventory, a code indicating tree suitability for timber products, or the extent of decay in the butt section of down-dead trees. It is recorded on live standing, standing-dead, and down dead trees that are ω1.0 inch d.b.h. Tree class is basically a check for the straightness and soundness of the sawlog portion on a sawtimber tree or the potential sawlog portion on a poletimber tree or sapling. ""Sawlog portion"" is defined as the length between the 1-foot stump and the 9.0-inch top diameter of outside bark, DOB, for hardwoods, or the 7.0-inch top DOB for softwoods. For more detailed description, see the regional field guide located at the NRS Data Collection web page (https://research.fs.usda.gov/nrs/programs/fia). Only populated by certain FIA work units (SURVEY.RSCD = 23)."
3.1.88,TREECLCD_RMRS,"Tree class code, Rocky Mountain Research Station",NUMBER(2),A code indicating the general quality of the tree. Only populated by certain FIA work units (SURVEY.RSCD = 22).
3.1.89,STANDING_DEAD_CD,Standing dead code,NUMBER(2),"A code indicating if a tree qualifies as standing dead. To qualify as a standing dead tally tree, the dead tree must be ω1.0 inch d.b.h., have a bole that has an unbroken actual length (ACTUALHT) ω4.5 feet, and lean <45 degrees from vertical as measured from the base of the tree to 4.5 feet. For woodland species with multiple stems, a tree is considered down if more than 2/3 of the volume is no longer attached or upright;
cut and removed volume is not considered. For woodland species with single stems to qualify as a standing dead tally tree, dead trees must be ω1.0 inch d.r.c., be ω1.0 foot in unbroken actual length (ACTUALHT), and lean <45 degrees from vertical.
Populated where PLOT.MANUAL ω2.0; may be populated using information collected on dead trees in earlier inventories for dead trees.
Note: Starting with PLOT.MANUAL = 7.0, the core minimum diameter to qualify for a standing dead tree was changed from 5.0 inches to 1.0 inch."
3.1.90,PREV_STATUS_CD,Previous tree status code ,NUMBER(1),"Tree status that was recorded at the previous inventory on all tally trees ω1.0 inch d.b.h./d.r.c. Includes all new standing dead trees (STATUSCD = 2, STANDING_DEAD_CD = 1, RECONCILECD >0)."
3.1.91,PREV_WDLDSTEM,Previous woodland stem count ,NUMBER(3),Woodland tree species stem count that was recorded at the previous inventory.
3.1.92,TPA_UNADJ,Trees per acre unadjusted ,"NUMBER(11,6)","The number of trees per acre that the sample tree theoretically represents based on the sample design. For fixed-radius plots taken with the mapped plot design (PLOT.DESIGNCD = 1), TPA_UNADJ is set to a constant derived from the plot size and equals 6.018046 for trees sampled on subplots, 74.965282 for trees sampled on microplots, and 0.999188 for trees sampled on macroplots. Variable-radius plots were often used in earlier inventories, so the value in TPA_UNADJ decreases as the tree diameter increases. Based on the procedures described in Bechtold and Patterson (2005), this attribute must be adjusted using factors stored in the POP_STRATUM table to derive population estimates. Examples of estimating population totals are shown in The
Forest Inventory and Analysis Database: Population Estimation User Guide."
3.1.93,DRYBIO_BOLE,Dry biomass of wood in the merchantable bole,"NUMBER(13,6)","The oven-dry biomass, in pounds, of wood in the merchantable bole of timber species (trees where diameter is measured at breast height [d.b.h.]) ω5.0 inches d.b.h., from a 1-foot stump to a minimum 4-inch top diameter. Calculated for live and standing dead trees. This is a per tree value and must be multiplied by TPA_UNADJ to obtain per acre information. This attribute is blank (null) for timber species with DIA <5.0 inches and for woodland species. Refer to appendix K for information on FIA volume, biomass, and carbon estimation."
3.1.94,DRYBIO_STUMP,Dry biomass of wood in the stump ,"NUMBER(13,6)","The oven-dry biomass, in pounds, of wood in the stump of timber species (trees where diameter is measured at breast height [d.b.h.]) ω5.0 inches d.b.h. The stump is that portion of the tree from the ground line to the bottom of the merchantable bole (i.e., below 1 foot). Calculated for live and standing dead trees. This is a per tree value and must be multiplied by TPA_UNADJ to obtain per acre information. This attribute is blank (null) for timber species with DIA <5.0 inches and for woodland species. Refer to appendix K for information on FIA volume, biomass, and carbon estimation."
3.1.95,DRYBIO_BG,Belowground dry biomass ,"NUMBER(13,6)","The oven-dry biomass, in pounds, of the belowground portion of a tree, including coarse roots with a root diameter ω0.1 inch. This is a modeled estimate, calculated for live and standing dead trees ω1.0 inch d.b.h./d.r.c. This is a per tree value and must be multiplied by TPA_UNADJ to obtain per acre information. Refer to appendix K for information on FIA volume, biomass, and carbon estimation.
Note: Not populated for standing dead saplings (1.0-4.9 inches d.b.h./d.r.c.) when PLOT.MANUAL <7.0."
3.1.96,CARBON_AG,Aboveground carbon of wood and bark,"NUMBER(13,6)","The carbon, in pounds, of wood and bark in the aboveground portion, excluding foliage, of live and standing dead trees ω1.0 inch d.b.h./d.r.c. This is a per tree value and must be multiplied by TPA_UNADJ to obtain per acre information. The amount of carbon is calculated based on applying species-specific carbon fractions to the aboveground biomass:
CARBON_AG = REF_SPECIES.CARBON_RATIO_LIVE * DRYBIO_AG
This attribute is populated for all tree species tallied in the continental U.S. as well as both the Caribbean and Pacific Islands, including Hawaii (refer to the FIA Master Tree Species List, available at the following web address: https://www.fia.fs.usda.gov/library/field-guides-methods-proc/). Refer to appendix K for information on FIA volume, biomass, and carbon estimation.
Note: Not populated for standing dead saplings (1.0-4.9 inches d.b.h./d.r.c.) when PLOT.MANUAL <7.0."
3.1.97,CARBON_BG,Belowground carbon,"NUMBER(13,6)","The carbon, in pounds, of the belowground portion of a tree, including coarse roots with a root diameter ω0.1 inch. Calculated for live and standing dead trees ω1.0 inch d.b.h./d.r.c. This is a per tree value and must be multiplied by TPA_UNADJ to obtain per acre information. The amount of carbon is calculated based on applying species-specific carbon fractions to the belowground biomass: CARBON_BG = REF_SPECIES.CARBON_RATIO_LIVE * DRYBIO_BG Refer to appendix K for information on FIA volume, biomass, and carbon estimation.
Note: Not populated for standing dead saplings (1.0-4.9 inches d.b.h./d.r.c.) when PLOT.MANUAL <7.0."
3.1.98,CYCLE,Inventory visit number ,NUMBER(2),"A number assigned to a set of plots, measured over a particular period of time from which a State estimate using all possible plots is obtained. A cycle number >1 does not necessarily mean that information for previous cycles resides in the database. A cycle is relevant for periodic and annual inventories."
3.1.99,SUBCYCLE,Inventory subcycle number ,NUMBER(2),"For an annual inventory that takes n years to measure all plots, subcycle shows in which of the n years of the cycle the data were measured. Subcycle is 0 for a periodic inventory. Subcycle 99 may be used for plots that are not included in the estimation process."
3.1.100,BORED_CD_PNWRS,"Tree bored code, Pacific Northwest Research Station",NUMBER(1),Used in conjunction with tree age (BHAGE and TOTAGE). Only populated by certain FIA work units (SURVEY.RSCD = 26).
3.1.101,DAMLOC1_PNWRS,"Damage location 1, Pacific
Northwest Research Station",NUMBER(2),The location on the tree where Damage Agent 1 is found. Only populated by certain FIA work units (SURVEY.RSCD = 26).
3.1.102,DAMLOC2_PNWRS,"Damage location 2, Pacific
Northwest Research Station",NUMBER(2),See DAMLOC1_PNWRS. Only populated by certain FIA work units (SURVEY.RSCD = 26).
3.1.103,DIACHECK_PNWRS,"Diameter check, Pacific Northwest Research Station",NUMBER(1),"A separate estimate of the diameter without the obstruction if the diameter was estimated because of moss/vine/obstruction, etc. Only populated by certain FIA work units (SURVEY.RSCD = 26)."
3.1.104,DMG_AGENT1_CD_PNWRS,"Damage agent 1,  Pacific Northwest Research Station",NUMBER(2),"Primary damage agent code in PNWRS. Up to three damaging agents can be coded in PNWRS as DMG_AGENT1_CD_PNWRS, DMG_AGENT2_CD_PNWRS, and DMG_AGENT3_CD_PNWRS. A 2-digit code (with values from 01 to 99) indicating the tree damaging agent that is considered to be of greatest importance to predict tree growth, survival, and forest composition and structure. Additionally, there are two classes of damaging agents. Class I damage agents are considered more important than class II agents and are thus coded as a primary agent before the class II agents. For more information, see appendix I. Only populated by certain FIA work units (SURVEY.RSCD = 26)."
3.1.105,DMG_AGENT2_CD_PNWRS,"Damage agent 2,  Pacific Northwest Research Station",NUMBER(2),"See DMG_AGENT1_CD_PNWRS.
Only populated by certain FIA work units (SURVEY.RSCD = 26)."
3.1.106,DMG_AGENT3_CD_PNWRS,"Damage agent 3,  Pacific Northwest Research Station",NUMBER(2),"See DMG_AGENT1_CD_PNWRS.
Only populated by certain FIA work units (SURVEY.RSCD = 26)."
3.1.107,MIST_CL_CD_PNWRS,"Leafy mistletoe class code, Pacific Northwest Research Station",NUMBER(1),"All juniper species, incense cedars, white fir (CA only) and oak trees are rated for leafy mistletoe infection. This item is used to describe the extent and severity of leafy mistletoe infection (see MIST_CL_CD for dwarf mistletoe information). Only populated by certain FIA work units
(SURVEY.RSCD = 26)."
3.1.108,SEVERITY1_CD_PNWRS,"Damage severity 1, Pacific
Northwest Research Station",NUMBER(1),"Damage severity depends on the damage agent coded (see appendix I for codes). This is a 2-digit code that indicates either percent of location damaged (01-99), or the appropriate class of damage (values vary from 0-9 depending on the specific Damage Agent). Only populated by certain FIA work units (SURVEY.RSCD = 26)."
3.1.109,SEVERITY1A_CD_PNWRS,"Damage severity 1A, Pacific
Northwest Research Station",NUMBER(2),"Damage severity depends on the damage agent coded (see appendix I for codes). This is a 2-digit code indicating either percent of location damaged (01-99), or the appropriate class of damage (values vary from 0-4 depending on the specific Damage Agent). Only populated by certain FIA work units (SURVEY.RSCD = 26)."
3.1.110,SEVERITY1B_CD_PNWRS,"Damage severity 1B, Pacific
Northwest Research Station",NUMBER(1),Damage severity B is only coded when the Damage Agent is white pine blister rust (36). Only populated by certain FIA work units (SURVEY.RSCD= 26).
3.1.111,SEVERITY2_CD_PNWRS,"Damage severity 2, Pacific
Northwest Research Station",NUMBER(1),"Damage severity depends on the damage agent coded (see appendix I for codes). This is a 2-digit code indicating either percent of location damaged (01-99), or the appropriate class of damage (values vary from 0-9 depending on the specific Damage Agent). Only populated by certain FIA work units (SURVEY.RSCD= 26)."
3.1.112,SEVERITY2A_CD_PNWRS,"Damage severity 2A, Pacific
Northwest Research Station",NUMBER(2),See SEVERITY1A_CD_PNWRS. Only populated by certain FIA work units (SURVEY.RSCD = 26).
3.1.113,SEVERITY2B_CD_PNWRS,"Damage severity 2B, Pacific
Northwest Research Station",NUMBER(1),See SEVERITY1B_CD_PNWRS. Only populated by certain FIA work units (SURVEY.RSCD = 26).
3.1.114,SEVERITY3_CD_PNWRS,"Damage severity 3, Pacific
Northwest Research Station",NUMBER(1),"Damage severity depends on the damage agent coded (see appendix I for codes). This is a 2-digit code indicating either percent of location damaged (01-99), or the appropriate class of damage (values vary
from 0-9 depending on the specific Damage Agent). Only populated by certain FIA work units (SURVEY.RSCD = 26)."
3.1.115,UNKNOWN_DAMTYP1_PNWRS,"Unknown damage type 1, Pacific Northwest Research Station",NUMBER(1),A code indicating the sign or symptom recorded when UNKNOWN damage code 90 is used. Only populated by certain FIA work units (SURVEY.RSCD = 26).
3.1.116,UNKNOWN_DAMTYP2_PNWRS,"Unknown damage type 2, Pacific Northwest Research Station",NUMBER(1),See UNKNOWN_DAMTYP1_PNWRS. Only populated by certain FIA work units (SURVEY.RSCD = 26).
3.1.117,PREV_PNTN_SRS,"Previous periodic prism point, tree number, Southern Research Station",NUMBER(4),"In some older Southeast Experiment Station States, the prism point, tree number (PNTN) of the current cycle did not match the previous cycle's prism point, tree number. PREV_PNTN_SRS is used to join the current and the previous prism plot trees. Not populated for the Caribbean Islands."
3.1.118,DISEASE_SRS,"Disease, Southern Research Station ",NUMBER(1),"A code indicating the incidence of fusiform, comandra rust or dieback. Dieback is only recorded for live hardwood trees where DIA ω5.0 inches with at least 10 percent dieback. Fusiform and comandra rust are only recorded for live pine trees ω5.0 inches d.b.h. with the following species codes: 110, 111, 121, 126, 128, or 131. Populated for all forested plots using the National Field Guide protocols (PLOT.MANUAL = 1.6-5.1). Only populated by certain FIA work units (SURVEY.RSCD= 33)."
3.1.119,DIEBACK_SEVERITY_SRS,"Dieback severity, Southern Research Station",NUMBER(2),A code indicating the severity of hardwood crown dieback. Populated when DISEASE_SRS = 2. Populated for all forested plots using the National Field Guide protocols (PLOT.MANUAL = 1.6-5.1). Only populated by certain FIA work units (SURVEY.RSCD = 33).
